{
  "workflow_id": "WF-READONLY-001",
  "project_path": "D:\\example-project",
  "controller_thread_id": "controller-example",
  "controller_host_id": "local",
  "status": "approved",
  "authorization": "read-only",
  "created_at": "2026-09-15T00:00:00+08:00",
  "updated_at": "2026-09-15T00:00:00+08:00"
}
